{
  "schemaVersion": "0.1",
  "meta": {
    "name": "示例·两室两厅",
    "sourceType": "electronic",
    "floorHeight": 2.8
  },
  "walls": [
    {
      "id": "w-north",
      "p1": { "x": 0, "y": 0 },
      "p2": { "x": 10.2, "y": 0 },
      "thickness": 0.24,
      "openings": [
        { "id": "o-living-win", "type": "window", "t": 1.0, "width": 2.4, "height": 1.5, "sill": 0.9 },
        { "id": "o-master-win-n", "type": "window", "t": 6.4, "width": 1.8, "height": 1.5, "sill": 0.9 }
      ]
    },
    {
      "id": "w-east",
      "p1": { "x": 10.2, "y": 0 },
      "p2": { "x": 10.2, "y": 8.4 },
      "thickness": 0.24,
      "openings": [
        { "id": "o-master-win-e", "type": "window", "t": 1.2, "width": 1.5, "height": 1.5, "sill": 0.9 },
        { "id": "o-bath-win-e", "type": "window", "t": 5.6, "width": 0.8, "height": 1.0, "sill": 1.2 }
      ]
    },
    {
      "id": "w-south",
      "p1": { "x": 10.2, "y": 8.4 },
      "p2": { "x": 0, "y": 8.4 },
      "thickness": 0.24,
      "openings": [
        { "id": "o-bath-win-s", "type": "window", "t": 1.0, "width": 0.8, "height": 1.0, "sill": 1.2 },
        { "id": "o-bd2-win-s", "type": "window", "t": 4.2, "width": 1.8, "height": 1.5, "sill": 0.9 }
      ]
    },
    {
      "id": "w-west",
      "p1": { "x": 0, "y": 8.4 },
      "p2": { "x": 0, "y": 0 },
      "thickness": 0.24,
      "openings": [
        { "id": "o-kitchen-win", "type": "window", "t": 1.2, "width": 1.2, "height": 1.2, "sill": 0.9 },
        { "id": "o-entry-door", "type": "door", "t": 4.6, "width": 1.0, "height": 2.05, "sill": 0 }
      ]
    },
    {
      "id": "w-lr-master",
      "p1": { "x": 5.2, "y": 0 },
      "p2": { "x": 5.2, "y": 4.4 },
      "thickness": 0.12,
      "openings": [
        { "id": "o-master-door", "type": "door", "t": 2.8, "width": 0.9, "height": 2.05, "sill": 0 }
      ]
    },
    {
      "id": "w-mid",
      "p1": { "x": 0, "y": 4.4 },
      "p2": { "x": 10.2, "y": 4.4 },
      "thickness": 0.12,
      "openings": [
        { "id": "o-kitchen-door", "type": "door", "t": 1.2, "width": 0.9, "height": 2.05, "sill": 0 },
        { "id": "o-bd2-door", "type": "door", "t": 3.8, "width": 0.9, "height": 2.05, "sill": 0 },
        { "id": "o-bath-door", "type": "door", "t": 7.6, "width": 0.9, "height": 2.05, "sill": 0 }
      ]
    },
    {
      "id": "w-kitchen-bd2",
      "p1": { "x": 2.6, "y": 4.4 },
      "p2": { "x": 2.6, "y": 8.4 },
      "thickness": 0.12,
      "openings": []
    },
    {
      "id": "w-bd2-bath",
      "p1": { "x": 7.0, "y": 4.4 },
      "p2": { "x": 7.0, "y": 8.4 },
      "thickness": 0.12,
      "openings": []
    }
  ],
  "rooms": [
    {
      "id": "r-living",
      "name": "客厅",
      "polygon": [
        { "x": 0, "y": 0 },
        { "x": 5.2, "y": 0 },
        { "x": 5.2, "y": 4.4 },
        { "x": 0, "y": 4.4 }
      ],
      "labelPosition": { "x": 2.4, "y": 2.0 }
    },
    {
      "id": "r-master",
      "name": "主卧",
      "polygon": [
        { "x": 5.2, "y": 0 },
        { "x": 10.2, "y": 0 },
        { "x": 10.2, "y": 4.4 },
        { "x": 5.2, "y": 4.4 }
      ],
      "labelPosition": { "x": 7.6, "y": 2.0 }
    },
    {
      "id": "r-kitchen",
      "name": "厨房",
      "polygon": [
        { "x": 0, "y": 4.4 },
        { "x": 2.6, "y": 4.4 },
        { "x": 2.6, "y": 8.4 },
        { "x": 0, "y": 8.4 }
      ],
      "labelPosition": { "x": 1.2, "y": 6.2 }
    },
    {
      "id": "r-bedroom2",
      "name": "次卧",
      "polygon": [
        { "x": 2.6, "y": 4.4 },
        { "x": 7.0, "y": 4.4 },
        { "x": 7.0, "y": 8.4 },
        { "x": 2.6, "y": 8.4 }
      ],
      "labelPosition": { "x": 4.8, "y": 6.2 }
    },
    {
      "id": "r-bath",
      "name": "卫生间",
      "polygon": [
        { "x": 7.0, "y": 4.4 },
        { "x": 10.2, "y": 4.4 },
        { "x": 10.2, "y": 8.4 },
        { "x": 7.0, "y": 8.4 }
      ],
      "labelPosition": { "x": 8.6, "y": 6.2 }
    }
  ],
  "scale": {
    "references": [
      {
        "id": "s-north",
        "valueM": 10.2,
        "p1": { "x": 0, "y": 0 },
        "p2": { "x": 10.2, "y": 0 },
        "source": "annotation"
      },
      {
        "id": "s-west",
        "valueM": 8.4,
        "p1": { "x": 0, "y": 0 },
        "p2": { "x": 0, "y": 8.4 },
        "source": "annotation"
      },
      {
        "id": "s-master-bay",
        "valueM": 5.0,
        "p1": { "x": 5.2, "y": 0 },
        "p2": { "x": 10.2, "y": 0 },
        "source": "annotation"
      }
    ],
    "deviationToleranceM": 0.15
  }
}
